{
  "schema_version": "1.0",
  "feature_id": "readable-cto-passing",
  "handoff_id": "readable-cto-passing.handoff.v1",
  "handoff_digest": "7644909b7d17135edef84221f57709f0cff3d853e11fa51500c0ee2aa02c9ab7",
  "execution_claim_id": "claim-b6630cc0c3b4564702f310e9bc8993e8",
  "execution_owner": "cto",
  "execution_run_id": "readable-cto-exec-wave-01a06e95",
  "profile_hash": "4410dbc9f79aa780862e28b53905cccc9f963c375c2c5f0c6d170f03b2f135b5",
  "entries": [
    {
      "entry_id": "closure.e0f2ee737b4ccc990dd6d3743bb9b316120f8ff4253efac771bd5c31d6cd6e04",
      "subject_kind": "requirement",
      "subject_id": "FR-1",
      "requirement_id": "FR-1",
      "observable_behavior": true,
      "implementation_evidence_refs": [
        {
          "artifact_id": "conformance_evidence-readable-cto-passing-implementation.v2",
          "path": ".work-state/features/readable-cto-passing/artifacts/conformance_evidence-readable-cto-passing-implementation.v2.json",
          "sha256": "d902b50a41d4a901bffffb809ae1ac07bcf87865cd2879d25a512e8338934aa1",
          "schema_status": "met",
          "quality_gate_status": "met"
        }
      ],
      "review_verdict": "pass",
      "review_evidence_refs": [
        {
          "artifact_id": "conformance_evidence-readable-cto-passing-qa-runtime-support.v2",
          "path": ".work-state/features/readable-cto-passing/artifacts/conformance_evidence-readable-cto-passing-qa-runtime-support.v2.json",
          "sha256": "4c06946c25b2ebfd78f494000e472af782ac54d8e30a4b8c3b7ee47f7e50774d",
          "schema_status": "met",
          "quality_gate_status": "met"
        }
      ],
      "test_evidence": [
        {
          "evidence_ref": {
            "artifact_id": "conformance_evidence-readable-cto-passing-qa-runtime-support.v2",
            "path": ".work-state/features/readable-cto-passing/artifacts/conformance_evidence-readable-cto-passing-qa-runtime-support.v2.json",
            "sha256": "4c06946c25b2ebfd78f494000e472af782ac54d8e30a4b8c3b7ee47f7e50774d",
            "schema_status": "met",
            "quality_gate_status": "met"
          },
          "test_kind": "runtime",
          "status": "pass",
          "executed_at": "2026-09-05T00:00:00.000Z"
        }
      ],
      "status": "pass",
      "findings": []
    },
    {
      "entry_id": "closure.831814cf042323f928495e987bf94e915e65a6932810188f18991272cd4a2974",
      "subject_kind": "acceptance_scenario",
      "subject_id": "AC-1",
      "requirement_id": "FR-1",
      "observable_behavior": true,
      "implementation_evidence_refs": [
        {
          "artifact_id": "conformance_evidence-readable-cto-passing-implementation.v2",
          "path": ".work-state/features/readable-cto-passing/artifacts/conformance_evidence-readable-cto-passing-implementation.v2.json",
          "sha256": "d902b50a41d4a901bffffb809ae1ac07bcf87865cd2879d25a512e8338934aa1",
          "schema_status": "met",
          "quality_gate_status": "met"
        }
      ],
      "review_verdict": "pass",
      "review_evidence_refs": [
        {
          "artifact_id": "conformance_evidence-readable-cto-passing-qa-runtime-support.v2",
          "path": ".work-state/features/readable-cto-passing/artifacts/conformance_evidence-readable-cto-passing-qa-runtime-support.v2.json",
          "sha256": "4c06946c25b2ebfd78f494000e472af782ac54d8e30a4b8c3b7ee47f7e50774d",
          "schema_status": "met",
          "quality_gate_status": "met"
        }
      ],
      "test_evidence": [
        {
          "evidence_ref": {
            "artifact_id": "conformance_evidence-readable-cto-passing-qa-runtime-support.v2",
            "path": ".work-state/features/readable-cto-passing/artifacts/conformance_evidence-readable-cto-passing-qa-runtime-support.v2.json",
            "sha256": "4c06946c25b2ebfd78f494000e472af782ac54d8e30a4b8c3b7ee47f7e50774d",
            "schema_status": "met",
            "quality_gate_status": "met"
          },
          "test_kind": "runtime",
          "status": "pass",
          "executed_at": "2026-09-05T00:00:00.000Z"
        }
      ],
      "status": "pass",
      "findings": []
    }
  ],
  "quality_gate_results": [
    {
      "gate_id": "cto-handoff-constitution-binding.readable-cto-passing.handoff.v1",
      "source": "project_constitution",
      "status": "pass",
      "evidence_refs": [],
      "findings": []
    }
  ],
  "overall_status": "pass",
  "blocking_findings": [],
  "next_action": "complete_feature",
  "conformance_id": "implementation-conformance.6391e3c54e44db8a8c229cfc6379d5ebd4b5b5fcd6411cece73c0b7706232659",
  "matrix_digest": "6391e3c54e44db8a8c229cfc6379d5ebd4b5b5fcd6411cece73c0b7706232659",
  "evaluated_at": "2026-09-04T23:32:53.198Z"
}
